post,date_posted,likes,quotes,replies,retweets,url,hour,words
@stanwegner That's real video from the DRACO camera aboard the #DARTMission.,2022-09-26 23:54:49+00:00,616,2,21,32,https://twitter.com/NASA/status/1574548077385433088,23,12
Singer @JoshGroban and jazz pianist @HerbieHancock performed “The Star-Spangled Banner” in honor of the historic launch of the #Artemis I mission around the Moon. https://t.co/nhS7pB5mI8,2022-11-16 08:49:04+00:00,2829,67,108,493,https://twitter.com/NASA/status/1592801917574385665,8,29
"LIVE NOW: Following the successful splashdown of the #Artemis I mission to the Moon and back, our experts are on @Reddit and ready to take your questions! Ask us anything! https://t.co/zXGRs9QI84 https://t.co/7FumEUYfTi",2022-12-13 19:02:06+00:00,3864,16,96,385,https://twitter.com/NASA/status/1602740665485778944,19,38
NASA scientists are at #AGU22 this week discussing topics ranging from sea level change to exploring oceans on other worlds to the #Artemis I mission. Follow @NASAExhibit for updates and discover when to tune in: https://t.co/vdamkEHlSM https://t.co/yVmbQbuSeU,2022-12-12 22:14:01+00:00,4393,20,133,569,https://twitter.com/NASA/status/1602426572262227968,22,43
Talk about showing both sides of the story. Nice frontback Orion. On flight day 9 @NASA_Orion took these images looking forward to the Moon and back home toward Earth. More full-res images: https://t.co/pUudalErEr Track #Artemis I in real time: https://t.co/fCVt3jyqwy https://t.co/bnY0uXbWnh,2022-11-25 18:28:40+00:00,5557,68,122,905,https://twitter.com/NASA/status/1596209269330051072,18,51